  {
  "$schema": "http://json-schema.org/draft-04/schema",
  "title": "Case",
  "description": "A specific binary decision to be notarized",
  "type": "object",
  "properties": {
    "id": {
      "description": "Unique ID",
      "$ref": "Iri.json"
    },
    "execution_condition": {
      "description": "Cryptographic condition",
      "$ref": "Condition.json"
    },
    "expires_at": {
      "description": "The date when the case expires and will be rejected by the notary",
      "$ref": "Date.json"
    },
    "notaries": {
      "description": "Notaries (including this one) which are participating in this case",
      "type": "array",
      "items": {
        "$ref": "Iri.json"
      }
    },
    "notification_targets": {
      "description": "URIs Notary sends HTTP PUT request to, to notify the completion of this case",
      "type": "array",
      "items": {
        "$ref": "Iri.json"
      }
    },
    "state": {
      "description": "All cases start in the proposed state and are either executed or rejected",
      "enum": ["proposed", "executed", "rejected"]
    }
  },
  "required": ["execution_condition", "expires_at", "notaries", "notification_targets"],
  "additionalProperties": false
}
