{
  "id": "http://localhost/cases/75159fb1-8ed2-4c92-9af7-0f48e2616f47",
  "execution_condition": "cc:0:3:vmvf6B7EpFalN6RGDx9F4f4z0wtOIgsIdCmbgv06ceI:7",
  "expires_at": "2015-11-19T20:27:12.299Z",
  "notaries": [
    "http://localhost"
  ],
  "notification_targets": ["https://localhost:3001/transfers/123", "https://localhost:3001/transfers/123"]
}